{"$schema":"https://json-schema.org/draft/2020-12/schema","$id":"https://agentfables.org/schemas/card.schema.json","type":"object","additionalProperties":false,"required":["id","rev","title","trigger","near_miss","do_not_infer","verify","unverifiable","full"],"properties":{"id":{"pattern":"^AF-[0-9]{4}$"},"rev":{"pattern":"^sha256:[a-f0-9]{64}$"},"title":{"type":"string"},"trigger":{"type":"string"},"near_miss":{"type":"array","items":{"type":"string"}},"do_not_infer":{"type":"string"},"verify":{"type":"array","minItems":1,"items":{"type":"object"}},"unverifiable":{"type":"boolean"},"full":{"pattern":"^signatures/af-[0-9]{4}\\.md$"}}}
