{"id":"AF-0016","rev":"sha256:6ebe28f86f9ac5fb22a9045d7fc186ce9f77697a8a80623a52e745b27e8de895","title":"Untrusted inbound content triggers zero-click retrieval and exfiltration","trigger":"agent has retrieval-augmented access to inbound content it did not request (email, calendar invites, shared documents) that is automatically ingested into working context","near_miss":[],"do_not_infer":"Trusting content the agent did not request as if it entered through the same channel as the user's own instructions.","verify":[{"kind":"unverifiable","reason":"host must translate the record verification into an independent predicate"}],"unverifiable":true,"full":"signatures/af-0016.md"}
