{"id":"AF-0017","rev":"sha256:38d52e03c5a906b7c061962eb3016d59c186594bc67b8219617ffaca5cfd4372","title":"Hidden webpage text steers a browsing agent into exfiltrating credentials","trigger":"agent autonomously browses or renders webpage content, including elements invisible to a human viewer such as white-on-white text or HTML comments, as part of fulfilling a user request","near_miss":[],"do_not_infer":"Rendering fetched pages into agent context without separating visible text from hidden or invisible instructions.","verify":[{"kind":"unverifiable","reason":"host must translate the record verification into an independent predicate"}],"unverifiable":true,"full":"signatures/af-0017.md"}
