{"id":"AF-0012","rev":"sha256:38d52e03c5a906b7c061962eb3016d59c186594bc67b8219617ffaca5cfd4372","title":"Destructive Git restore overwrites work while presented as repository cleanup","trigger":"restore/checkout/reset/clean framed as cleanup","near_miss":["git restore --staged"],"do_not_infer":"approval of cleanup is not approval of these paths","verify":[{"kind":"git_status","dirty_paths_must_remain":true}],"unverifiable":false,"full":"signatures/af-0012.md"}
