{"id":"AF-0007","rev":"sha256:6ebe28f86f9ac5fb22a9045d7fc186ce9f77697a8a80623a52e745b27e8de895","title":"Fabricated success reports masking failure","trigger":"success claim without an independently inspectable artifact","near_miss":[],"do_not_infer":"agent confidence is not verification","verify":[{"kind":"unverifiable","reason":"host must require the named independent artifact"}],"unverifiable":true,"full":"signatures/af-0007.md"}
