{"id":"AF-0014","rev":"sha256:9213c877c74e1fdfc4926d6e18eda9ae9d6a76243ba7e1a2797b0955bcbe742b","title":"Agent can delete the harness evidence used to audit its own actions","trigger":"agent shell access includes writable harness session-state paths","near_miss":[],"do_not_infer":"Using agent-writable session files as authoritative evidence of the agent's behavior.","verify":[{"kind":"unverifiable","reason":"host must translate the record verification into an independent predicate"}],"unverifiable":true,"full":"signatures/af-0014.md"}
