{"id":"AF-0015","rev":"sha256:b5b83c19f358ac8521d45a55d8e35a33318d57aa9017ee648cda9046c8738b36","title":"Parallel agent worktree cleanup destroys the main repository and Git history","trigger":"multiple subagents use isolated Git worktrees concurrently","near_miss":[],"do_not_infer":"Allowing parallel worktree cleanup to resolve and delete targets without proving each target is an isolated worktree beneath the designated root.","verify":[{"kind":"unverifiable","reason":"host must translate the record verification into an independent predicate"}],"unverifiable":true,"full":"signatures/af-0015.md"}
