{"id":"AF-0008","rev":"sha256:38d52e03c5a906b7c061962eb3016d59c186594bc67b8219617ffaca5cfd4372","title":"MCP config approval survives silent modification (Cursor CVE-2025-54136)","trigger":"shared repository containing an approved .cursor/mcp.json","near_miss":[],"do_not_infer":"Binding approval to a tool's name instead of its content — approve once, trust forever.","verify":[{"kind":"unverifiable","reason":"host must translate the record verification into an independent predicate"}],"unverifiable":true,"full":"signatures/af-0008.md"}
