{"id":"AF-0032","rev":"sha256:b5b83c19f358ac8521d45a55d8e35a33318d57aa9017ee648cda9046c8738b36","title":"A tool's success confirmation is mistaken for the content it confirms","trigger":"a tool's response separates a human-readable confirmation (\"successfully downloaded...\") from the actual content, in a typed block the calling client may not support","near_miss":[],"do_not_infer":"Treating a tool's success confirmation message as equivalent to having received the content it confirms.","verify":[{"kind":"unverifiable","reason":"host must translate the record verification into an independent predicate"}],"unverifiable":true,"full":"signatures/af-0032.md"}
