{"id":"AF-0031","rev":"sha256:b5b83c19f358ac8521d45a55d8e35a33318d57aa9017ee648cda9046c8738b36","title":"An unconfirmed or failed tool result is treated as a successful one and acted on","trigger":"a tool call's actual result (success, failure, or empty) is not independently confirmed before the next step is planned","near_miss":[],"do_not_infer":"Planning the next action on the assumed outcome of a prior tool call instead of its confirmed result.","verify":[{"kind":"unverifiable","reason":"host must translate the record verification into an independent predicate"}],"unverifiable":true,"full":"signatures/af-0031.md"}
