{"id":"AF-0020","rev":"sha256:54f3d814b97d2b817738af071f4f1980ca4001f1a82fc440cbca1c5a12f17fcc","title":"Search snippets synthesized and presented as fully retrieved article content","trigger":"agent receives search_web results as snippet cards (title plus a truncated excerpt) with no following fetch_url call for the cited source","near_miss":[],"do_not_infer":"Treating a search snippet as the retrieved document and synthesizing claims beyond what the snippet text actually contains.","verify":[{"kind":"unverifiable","reason":"host must translate the record verification into an independent predicate"}],"unverifiable":true,"full":"signatures/af-0020.md"}
