{"id":"AF-0003","rev":"sha256:38d52e03c5a906b7c061962eb3016d59c186594bc67b8219617ffaca5cfd4372","title":"OAuth proxy executes commands from remote MCP endpoint (CVE-2025-6514)","trigger":"local MCP client connects to a remote server through mcp-remote","near_miss":[],"do_not_infer":"Delegating a trust decision to a URL — connecting the agent stack to an endpoint nobody vetted.","verify":[{"kind":"unverifiable","reason":"host must translate the record verification into an independent predicate"}],"unverifiable":true,"full":"signatures/af-0003.md"}
