{"id":"AF-0006","rev":"sha256:54cf07a080eea49f32c65367d4005525f9c403855d42f741ba325d76ea8ca817","title":"Installed AI CLIs weaponized by build-script malware (Nx s1ngularity)","trigger":"an agent CLI with filesystem reach is installed and on PATH","near_miss":[],"do_not_infer":"Shipping a bypass flag and assuming only the owner will ever type it.","verify":[{"kind":"unverifiable","reason":"host must translate the record verification into an independent predicate"}],"unverifiable":true,"full":"signatures/af-0006.md"}
