{"id":"AF-0025","rev":"sha256:6ebe28f86f9ac5fb22a9045d7fc186ce9f77697a8a80623a52e745b27e8de895","title":"Incomplete or timed-out search results treated as proof of absence","trigger":"agent issues a search call that returns incomplete_results=true, a documented indexing gap, or a small/zero result count","near_miss":[],"do_not_infer":"Treating an incomplete or partial search result set as an exhaustive index, and asserting absence from a query that never claimed completeness.","verify":[{"kind":"unverifiable","reason":"host must translate the record verification into an independent predicate"}],"unverifiable":true,"full":"signatures/af-0025.md"}
