{"id":"AF-0009","rev":"sha256:6ebe28f86f9ac5fb22a9045d7fc186ce9f77697a8a80623a52e745b27e8de895","title":"Unauthenticated dev tool reachable from the browser (MCP Inspector CVE-2025-49596)","trigger":"developer tooling for the agent stack running locally without authentication","near_miss":[],"do_not_infer":"Treating 'localhost' as a security boundary while a browser bridges it to the entire web.","verify":[{"kind":"unverifiable","reason":"host must translate the record verification into an independent predicate"}],"unverifiable":true,"full":"signatures/af-0009.md"}
