{"id":"AF-0010","rev":"sha256:b5b83c19f358ac8521d45a55d8e35a33318d57aa9017ee648cda9046c8738b36","title":"Broad token turns a prompt injection into cross-repo exfiltration (GitHub MCP toxic flow)","trigger":"agent reads untrusted content (public issues, PRs, comments) and can act with a token scoped wider than that content's repo","near_miss":[],"do_not_infer":"Letting retrieved content choose the destination while the token can reach everything.","verify":[{"kind":"unverifiable","reason":"host must translate the record verification into an independent predicate"}],"unverifiable":true,"full":"signatures/af-0010.md"}
