{"id":"AF-0005","rev":"sha256:38d52e03c5a906b7c061962eb3016d59c186594bc67b8219617ffaca5cfd4372","title":"Wiper prompt shipped inside a signed extension release (Amazon Q v1.84.0)","trigger":"agent toolchain auto-updates from a marketplace","near_miss":[],"do_not_infer":"Assuming the supply chain ships only code — instructions now ride the same channel and execute in the model, not the CPU.","verify":[{"kind":"unverifiable","reason":"host must translate the record verification into an independent predicate"}],"unverifiable":true,"full":"signatures/af-0005.md"}
