{"id":"AF-0011","rev":"sha256:6ebe28f86f9ac5fb22a9045d7fc186ce9f77697a8a80623a52e745b27e8de895","title":"Recursive deletion executes outside the configured approval boundary","trigger":"recursive delete or unlink after conversational approval","near_miss":[],"do_not_infer":"approval of a goal is not approval of resolved delete targets","verify":[{"kind":"fs_unchanged","path_from":"resolved_target"}],"unverifiable":false,"full":"signatures/af-0011.md"}
