{"id":"AF-0013","rev":"sha256:9213c877c74e1fdfc4926d6e18eda9ae9d6a76243ba7e1a2797b0955bcbe742b","title":"Agent shell snapshot persists exported credentials as replayable plaintext","trigger":"shell snapshot captures exported environment state","near_miss":[],"do_not_infer":"Treating all exported shell state as harmless replay configuration.","verify":[{"kind":"unverifiable","reason":"host must translate the record verification into an independent predicate"}],"unverifiable":true,"full":"signatures/af-0013.md"}
