{"id":"AF-0021","rev":"sha256:54f3d814b97d2b817738af071f4f1980ca4001f1a82fc440cbca1c5a12f17fcc","title":"Fetch reports success while returning near-empty or dropped content, treated as fully read","trigger":"fetch_url targets a page whose main content sits inside custom or unrecognized HTML elements (web components)","near_miss":[],"do_not_infer":"Treating a nominally successful fetch as a complete document body without checking whether meaningful content was actually extracted.","verify":[{"kind":"unverifiable","reason":"host must translate the record verification into an independent predicate"}],"unverifiable":true,"full":"signatures/af-0021.md"}
