{"id":"AF-0002","rev":"sha256:54cf07a080eea49f32c65367d4005525f9c403855d42f741ba325d76ea8ca817","title":"Stale local state treated as current territory","trigger":"destroy using stale or locally discovered infrastructure state","near_miss":[],"do_not_infer":"a discovered state file has no authority over current infrastructure","verify":[{"kind":"command_must_fail","cmd":"terraform plan -destroy","when":"destroy_count_or_workspace_unverified"}],"unverifiable":false,"full":"signatures/af-0002.md"}
