{"id":"AF-0004","rev":"sha256:54cf07a080eea49f32c65367d4005525f9c403855d42f741ba325d76ea8ca817","title":"Trusted MCP package turns on its users (Postmark rug-pull)","trigger":"MCP server installed from a registry and auto-updated without diff review","near_miss":[],"do_not_infer":"Extending yesterday's trust to today's version — treating a package name as a stable identity.","verify":[{"kind":"unverifiable","reason":"host must translate the record verification into an independent predicate"}],"unverifiable":true,"full":"signatures/af-0004.md"}
