{"id":"AF-0018","rev":"sha256:38d52e03c5a906b7c061962eb3016d59c186594bc67b8219617ffaca5cfd4372","title":"Fabricated citations submitted as authoritative without independent verification","trigger":"an agent or AI-assisted workflow drafts content containing citations to external authorities such as case law, articles, or documentation","near_miss":[],"do_not_infer":"Presenting a generated citation as verified because it is well-formed, without confirming the source exists.","verify":[{"kind":"unverifiable","reason":"host must translate the record verification into an independent predicate"}],"unverifiable":true,"full":"signatures/af-0018.md"}
