{"id":"AF-0001","rev":"sha256:38d52e03c5a906b7c061962eb3016d59c186594bc67b8219617ffaca5cfd4372","title":"Natural-language freeze treated as a control","trigger":"agent holds production database write credentials during a development task","near_miss":[],"do_not_infer":"Treating a natural-language instruction as a permission boundary.","verify":[{"kind":"unverifiable","reason":"host must translate the record verification into an independent predicate"}],"unverifiable":true,"full":"signatures/af-0001.md"}
